{
    "$schema": "https://json-schema.org/draft/2020-12/schema",
    "$id": "https://mandolin.github.io/HIA-Documentation/schemas/hia-project-manifest-0.1.0-draft.schema.json",
    "type": "object",
    "required": [
        "schemaVersion",
        "project"
    ],
    "additionalProperties": true,
    "anyOf": [
        {
            "required": [
                "inputs"
            ],
            "properties": {
                "inputs": {
                    "type": "array",
                    "minItems": 1
                }
            }
        },
        {
            "required": [
                "producers"
            ],
            "properties": {
                "producers": {
                    "type": "array",
                    "minItems": 1
                }
            }
        }
    ],
    "properties": {
        "schemaVersion": {
            "const": "0.1.0-draft"
        },
        "project": {
            "$ref": "#/$defs/project"
        },
        "producers": {
            "type": "array",
            "minItems": 1,
            "items": {
                "$ref": "#/$defs/producer"
            }
        },
        "profiles": {
            "type": "array",
            "items": {
                "$ref": "#/$defs/profileRef"
            }
        },
        "inputs": {
            "type": "array",
            "minItems": 1,
            "items": {
                "$ref": "#/$defs/input"
            }
        },
        "metadata": {
            "type": "object"
        }
    },
    "$defs": {
        "nonEmptyString": {
            "type": "string",
            "minLength": 1
        },
        "safeRelativePath": {
            "type": "string",
            "minLength": 1,
            "not": {
                "anyOf": [
                    {
                        "const": "."
                    },
                    {
                        "const": ".."
                    },
                    {
                        "pattern": "^(?:[A-Za-z]:|/|\\\\\\\\|[A-Za-z][A-Za-z0-9+.-]*:)"
                    },
                    {
                        "pattern": "(?:^|[\\\\/])\\.\\.(?:[\\\\/]|$)"
                    }
                ]
            }
        },
        "currentOrSafeRelativePath": {
            "type": "string",
            "minLength": 1,
            "not": {
                "anyOf": [
                    {
                        "const": ".."
                    },
                    {
                        "pattern": "^(?:[A-Za-z]:|/|\\\\\\\\|[A-Za-z][A-Za-z0-9+.-]*:)"
                    },
                    {
                        "pattern": "(?:^|[\\\\/])\\.\\.(?:[\\\\/]|$)"
                    }
                ]
            }
        },
        "project": {
            "type": "object",
            "required": [
                "name"
            ],
            "additionalProperties": true,
            "properties": {
                "id": {
                    "$ref": "#/$defs/nonEmptyString"
                },
                "name": {
                    "$ref": "#/$defs/nonEmptyString"
                },
                "title": {
                    "$ref": "#/$defs/nonEmptyString"
                },
                "defaultLocale": {
                    "$ref": "#/$defs/nonEmptyString"
                },
                "productVersion": {
                    "$ref": "#/$defs/nonEmptyString"
                },
                "locales": {
                    "type": "array",
                    "minItems": 1,
                    "items": {
                        "$ref": "#/$defs/nonEmptyString"
                    }
                }
            }
        },
        "profileRef": {
            "type": "object",
            "additionalProperties": true,
            "properties": {
                "profileId": {
                    "$ref": "#/$defs/nonEmptyString"
                },
                "profileVersion": {
                    "$ref": "#/$defs/nonEmptyString"
                },
                "layer": {
                    "$ref": "#/$defs/nonEmptyString"
                },
                "path": {
                    "$ref": "#/$defs/safeRelativePath"
                }
            }
        },
        "inputProfileRef": {
            "type": "object",
            "required": [
                "profileId"
            ],
            "additionalProperties": true,
            "properties": {
                "profileId": {
                    "$ref": "#/$defs/nonEmptyString"
                },
                "profileVersion": {
                    "$ref": "#/$defs/nonEmptyString"
                },
                "layer": {
                    "$ref": "#/$defs/nonEmptyString"
                }
            }
        },
        "producerInput": {
            "type": "object",
            "required": [
                "kind",
                "path"
            ],
            "additionalProperties": true,
            "properties": {
                "kind": {
                    "$ref": "#/$defs/nonEmptyString"
                },
                "language": {
                    "$ref": "#/$defs/nonEmptyString"
                },
                "path": {
                    "$ref": "#/$defs/safeRelativePath"
                },
                "applicationRoot": {
                    "$ref": "#/$defs/currentOrSafeRelativePath"
                },
                "artifactBasePath": {
                    "$ref": "#/$defs/safeRelativePath"
                },
                "hiaDocumentId": {
                    "$ref": "#/$defs/nonEmptyString"
                },
                "title": {
                    "$ref": "#/$defs/nonEmptyString"
                }
            }
        },
        "producer": {
            "type": "object",
            "required": [
                "id",
                "module",
                "inputs"
            ],
            "additionalProperties": true,
            "properties": {
                "id": {
                    "$ref": "#/$defs/nonEmptyString"
                },
                "module": {
                    "$ref": "#/$defs/safeRelativePath"
                },
                "exportName": {
                    "$ref": "#/$defs/nonEmptyString"
                },
                "failureMode": {
                    "enum": [
                        "fail",
                        "warn"
                    ]
                },
                "workspaceRoot": {
                    "$ref": "#/$defs/currentOrSafeRelativePath"
                },
                "outputDirectory": {
                    "$ref": "#/$defs/safeRelativePath"
                },
                "inputs": {
                    "type": "array",
                    "minItems": 1,
                    "items": {
                        "$ref": "#/$defs/producerInput"
                    }
                },
                "options": {
                    "type": "object"
                },
                "profileIds": {
                    "type": "array",
                    "minItems": 1,
                    "items": {
                        "$ref": "#/$defs/nonEmptyString"
                    }
                }
            }
        },
        "input": {
            "type": "object",
            "required": [
                "kind",
                "path"
            ],
            "additionalProperties": true,
            "properties": {
                "kind": {
                    "enum": [
                        "hia-document",
                        "jsdoc-integration",
                        "htmdoc-extraction",
                        "cssdoc-extraction",
                        "doc-source-map",
                        "documentation-producer-result"
                    ]
                },
                "path": {
                    "$ref": "#/$defs/safeRelativePath"
                },
                "domain": {
                    "enum": [
                        "js",
                        "css",
                        "html",
                        "dotnet",
                        "powershell",
                        "other"
                    ]
                },
                "profile": {
                    "$ref": "#/$defs/inputProfileRef"
                },
                "sourceRoot": {
                    "$ref": "#/$defs/safeRelativePath"
                },
                "artifactPolicy": {
                    "enum": [
                        "all",
                        "relations-only"
                    ]
                },
                "semanticPath": {
                    "type": "array",
                    "minItems": 1,
                    "items": {
                        "$ref": "#/$defs/semanticPathSegment"
                    }
                }
            }
        },
        "semanticPathSegment": {
            "type": "object",
            "required": [
                "kind",
                "id",
                "label"
            ],
            "additionalProperties": false,
            "properties": {
                "kind": {
                    "enum": [
                        "repository",
                        "package",
                        "layer",
                        "contract",
                        "operation",
                        "project",
                        "assembly",
                        "namespace",
                        "type"
                    ]
                },
                "id": {
                    "type": "string",
                    "pattern": "^[A-Za-z0-9][A-Za-z0-9._-]{0,127}$"
                },
                "label": {
                    "type": "string",
                    "minLength": 1,
                    "maxLength": 160
                }
            }
        }
    }
}
